{
  "$schema": "https://json-schema.org/draft/2020-12/schema",
  "$id": "https://github.com/mcp-sec-bench/schema/results.schema.json",
  "title": "mcp-sec-bench results",
  "description": "Machine-readable output of one benchmark run. Required fields are fixed by docs/scoring.md; changing them is a governance amendment, not a refactor.",
  "type": "object",
  "required": ["schema_version", "corpus_version", "generated_at", "scanners"],
  "additionalProperties": false,
  "properties": {
    "schema_version": { "const": "1.0" },
    "corpus_version": {
      "type": "string",
      "description": "Content hash of the corpus manifests. A score is only comparable to another score from the same corpus_version."
    },
    "generated_at": { "type": "string", "format": "date-time" },
    "runs_per_scanner": { "type": "integer", "minimum": 1 },
    "scanners": {
      "type": "array",
      "items": {
        "type": "object",
        "required": [
          "scanner_id", "scanner_version", "adapter_version", "config_label",
          "requires_signup", "stages_attempted", "runs", "metrics"
        ],
        "additionalProperties": false,
        "properties": {
          "scanner_id": { "type": "string" },
          "display_name": { "type": "string" },
          "scanner_version": { "type": "string" },
          "adapter_version": { "type": "string" },
          "config_label": {
            "type": "string",
            "description": "\"default\" is the documented default configuration. A vendor-supplied alternative appears as an additional row, never replacing the default."
          },
          "requires_signup": { "type": "boolean" },
          "unavailable_reason": {
            "type": ["string", "null"],
            "description": "Set when the scanner could not be run. The row is still published, with the reason, rather than the scanner being silently omitted."
          },
          "stages_attempted": {
            "type": "array",
            "items": { "enum": ["static", "runtime"] }
          },
          "not_attempted_classes": {
            "type": "array",
            "description": "Attack CLASSES excluded from this scanner's denominator because it does not attempt the stage they are reachable from. Class identifiers (\"A4\"), not (server, class) item identifiers -- elsewhere in this project \"item\" means a (server, class) pair, so this field is named for what it holds. Derivable from stages_attempted and the taxonomy's surface table. These are NOT false negatives.",
            "items": { "enum": ["A1","A2","A3","A4","A5","A6","A7","A8","A9","A10"] }
          },
          "runs": {
            "type": "integer",
            "minimum": 0,
            "description": "Runs completed. Zero is legitimate and means the scanner could not be run at all; governance.md requires such a scanner to be published with its unavailable_reason rather than omitted, so the schema must be able to represent it. validate_results checks that runs: 0 is always accompanied by an unavailable_reason, since a zero-run row with no reason would publish an empty score with no explanation."
          },
          "metrics": {
            "type": "object",
            "required": ["recall_per_class", "recall_overall", "precision_overall"],
            "additionalProperties": false,
            "properties": {
              "recall_per_class": {
                "type": "object",
                "description": "class -> {mean, min, max}. A null mean means no attempted item in that class, which is different from a mean of 0.0. Invariant, enforced by validate_results because JSON Schema cannot express it: min <= mean <= max, and either all three are null or all three are populated.",
                "additionalProperties": {
                  "type": ["object", "null"],
                  "properties": {
                    "mean": { "type": ["number", "null"] },
                    "min": { "type": ["number", "null"] },
                    "max": { "type": ["number", "null"] }
                  }
                }
              },
              "recall_overall": {
                "type": "object",
                "properties": {
                  "mean": { "type": ["number", "null"] },
                  "min": { "type": ["number", "null"] },
                  "max": { "type": ["number", "null"] }
                }
              },
              "precision_overall": {
                "type": "object",
                "properties": {
                  "mean": { "type": ["number", "null"] },
                  "min": { "type": ["number", "null"] },
                  "max": { "type": ["number", "null"] }
                }
              },
              "near_miss_mean": { "type": "number" },
              "unmapped_mean": { "type": "number" },
              "high_variance": {
                "type": "boolean",
                "description": "True when any per-class recall range exceeds 20 percentage points."
              },
              "variance_detail": {
                "type": "object",
                "additionalProperties": { "type": "number" }
              }
            }
          },
          "items": {
            "type": "array",
            "description": "Per-run, per-item outcomes. The audit trail behind the metrics.",
            "items": {
              "type": "object",
              "required": ["run_index", "server", "outcome"],
              "additionalProperties": false,
              "properties": {
                "run_index": { "type": "integer" },
                "server": { "type": "string" },
                "class": { "type": ["string", "null"] },
                "outcome": {
                  "enum": ["true_positive", "false_negative", "false_positive",
                           "tolerated", "unmapped", "not_applicable", "not_attempted"]
                },
                "stage_credited": { "type": ["string", "null"] },
                "finding_ref": { "type": ["string", "null"] },
                "note": { "type": "string" }
              }
            }
          },
          "findings": {
            "type": "array",
            "description": "Every finding the scanner produced, with the mapping decision applied to it. mapping_rationale_id makes any published number traceable to the specific judgment call behind it.",
            "items": {
              "type": "object",
              "required": ["run_index", "raw_label"],
              "additionalProperties": false,
              "properties": {
                "run_index": { "type": "integer" },
                "raw_label": { "type": "string" },
                "mapped_class": { "type": ["string", "null"] },
                "mapped_server": { "type": ["string", "null"] },
                "mapping_rationale_id": { "type": ["string", "null"] },
                "file": { "type": ["string", "null"] },
                "line": { "type": ["integer", "null"] },
                "severity": { "type": ["string", "null"] },
                "message": { "type": "string" }
              }
            }
          },
          "notes": { "type": "array", "items": { "type": "string" } }
        }
      }
    }
  }
}
